{
  "$schema": "https://json-schema.org/draft/2020-12/schema",
  "$id": "https://lumenaut-llc.github.io/oesis-program-specs/schemas/node-observation.schema.json",
  "title": "OESIS Node Observation",
  "type": "object",
  "required": [
    "schema_version",
    "node_id",
    "observed_at",
    "firmware_version",
    "location_mode",
    "sensors",
    "health"
  ],
  "additionalProperties": false,
  "properties": {
    "schema_version": {
      "const": "oesis.bench-air.v1"
    },
    "node_id": {
      "type": "string",
      "minLength": 1
    },
    "observed_at": {
      "type": "string",
      "format": "date-time"
    },
    "firmware_version": {
      "type": "string",
      "minLength": 1
    },
    "location_mode": {
      "type": "string",
      "enum": [
        "indoor",
        "sheltered",
        "outdoor"
      ]
    },
    "sensors": {
      "type": "object",
      "required": [
        "sht45",
        "bme680"
      ],
      "additionalProperties": false,
      "properties": {
        "sht45": {
          "$ref": "#/$defs/sht45Reading"
        },
        "bme680": {
          "$ref": "#/$defs/bme680Reading"
        }
      }
    },
    "derived": {
      "type": "object",
      "additionalProperties": false,
      "properties": {
        "temperature_c_primary": {
          "type": "number"
        },
        "relative_humidity_pct_primary": {
          "type": "number"
        },
        "pressure_hpa": {
          "type": "number"
        },
        "voc_trend_source": {
          "type": "string"
        }
      }
    },
    "health": {
      "type": "object",
      "required": [
        "uptime_s",
        "wifi_connected",
        "free_heap_bytes",
        "read_failures_total",
        "last_error"
      ],
      "additionalProperties": false,
      "properties": {
        "uptime_s": {
          "type": "integer",
          "minimum": 0
        },
        "wifi_connected": {
          "type": "boolean"
        },
        "free_heap_bytes": {
          "type": "integer",
          "minimum": 0
        },
        "read_failures_total": {
          "type": "integer",
          "minimum": 0
        },
        "last_error": {
          "type": [
            "string",
            "null"
          ]
        }
      }
    }
  },
  "$defs": {
    "sht45Reading": {
      "type": "object",
      "required": [
        "present",
        "temperature_c",
        "relative_humidity_pct"
      ],
      "additionalProperties": false,
      "properties": {
        "present": {
          "type": "boolean"
        },
        "temperature_c": {
          "type": "number"
        },
        "relative_humidity_pct": {
          "type": "number",
          "minimum": 0,
          "maximum": 100
        }
      }
    },
    "bme680Reading": {
      "type": "object",
      "required": [
        "present",
        "temperature_c",
        "relative_humidity_pct",
        "pressure_hpa",
        "gas_resistance_ohm"
      ],
      "additionalProperties": false,
      "properties": {
        "present": {
          "type": "boolean"
        },
        "temperature_c": {
          "type": "number"
        },
        "relative_humidity_pct": {
          "type": "number",
          "minimum": 0,
          "maximum": 100
        },
        "pressure_hpa": {
          "type": "number"
        },
        "gas_resistance_ohm": {
          "type": "number",
          "exclusiveMinimum": 0
        }
      }
    }
  }
}
