{
  "schema_version": "oesis.bench-air.v1",
  "node_id": "mast-lite-01",
  "observed_at": "2026-03-30T19:45:00Z",
  "firmware_version": "0.1.0",
  "location_mode": "sheltered",
  "sensors": {
    "sht45": {
      "present": true,
      "temperature_c": 18.4,
      "relative_humidity_pct": 62.1
    },
    "bme680": {
      "present": true,
      "temperature_c": 19.1,
      "relative_humidity_pct": 61.3,
      "pressure_hpa": 1012.4,
      "gas_resistance_ohm": 98450
    }
  },
  "derived": {
    "temperature_c_primary": 18.4,
    "relative_humidity_pct_primary": 62.1,
    "pressure_hpa": 1012.4,
    "voc_trend_source": "gas_resistance_ohm"
  },
  "health": {
    "uptime_s": 5420,
    "wifi_connected": true,
    "free_heap_bytes": 201480,
    "read_failures_total": 0,
    "last_error": null
  }
}
